{
  "$schema": "https://json-schema.org/draft/2020-12/schema", "$id": "https://example.invalid/global-province-map/spatial-golden-borders.schema.json", "title": "M24 Spatial Golden-Border Definitions", "type": "object",
  "required": ["schema_version", "document_type", "artifact_version", "pass_id", "start_date", "assertions"],
  "properties": {"schema_version": {"enum": ["0.1.0", "0.2.0", "0.3.0"]}, "document_type": {"const": "spatial_golden_borders"}, "artifact_version": {"type": "string", "minLength": 1}, "pass_id": {"type": "string", "minLength": 1}, "start_date": {"type": "string", "format": "date"},
    "assertions": {"type": "array", "minItems": 1, "items": {"type": "object", "required": ["assertion_id", "region_id", "layer", "assertion_type", "expectation", "subject_ids", "boundary_feature_ids", "spatial_relation", "unit", "tolerance", "notes"], "properties": {
      "assertion_id": {"type": "string", "minLength": 1}, "region_id": {"type": "string", "minLength": 1}, "layer": {"enum": ["geometry", "politics", "hierarchy", "gazetteer_relationships"]}, "assertion_type": {"enum": ["border", "capital", "outline", "seam"]}, "expectation": {"enum": ["positive", "negative_anachronism"]}, "subject_ids": {"$ref": "#/$defs/nonemptyStrings"}, "boundary_feature_ids": {"$ref": "#/$defs/strings"}, "spatial_relation": {"enum": ["border_matches_boundary_hausdorff_lte", "border_matches_boundary_hausdorff_km_lte", "capital_within_subject", "forbidden_outline_overlap_ratio_lte", "regional_status_boundary_matches_forbidden_modern_seam_ratio_lte"]}, "unit": {"enum": ["coordinate_units", "kilometres", "boolean", "ratio"]}, "tolerance": {"type": "number", "minimum": 0}, "notes": {"type": "string", "minLength": 1},
      "measurement_parameters": {"type": "object", "required": ["corridor_km"], "properties": {"corridor_km": {"type": "number", "exclusiveMinimum": 0}}, "additionalProperties": false},
      "tolerance_policy": {"type": "object", "required": ["fixed_before_measurement", "source_derived_tolerance", "source_ids"], "properties": {"fixed_before_measurement": {"const": true}, "source_derived_tolerance": {"type": "number", "minimum": 0}, "source_ids": {"$ref": "#/$defs/nonemptyStrings"}}, "additionalProperties": false}
    }, "additionalProperties": false}}
  }, "$defs": {"strings": {"type": "array", "uniqueItems": true, "items": {"type": "string", "minLength": 1}}, "nonemptyStrings": {"type": "array", "minItems": 1, "uniqueItems": true, "items": {"type": "string", "minLength": 1}}},
  "allOf": [
    {"if": {"properties": {"schema_version": {"const": "0.1.0"}}, "required": ["schema_version"]}, "then": {"properties": {"assertions": {"items": {"properties": {"assertion_type": {"enum": ["border", "capital", "outline"]}, "spatial_relation": {"enum": ["border_matches_boundary_hausdorff_lte", "capital_within_subject", "forbidden_outline_overlap_ratio_lte"]}, "unit": {"enum": ["coordinate_units", "boolean", "ratio"]}}}}}}},
    {"if": {"properties": {"schema_version": {"const": "0.2.0"}}, "required": ["schema_version"]}, "then": {"properties": {"assertions": {"items": {"properties": {"assertion_type": {"enum": ["border", "capital", "outline"]}, "spatial_relation": {"enum": ["border_matches_boundary_hausdorff_lte", "border_matches_boundary_hausdorff_km_lte", "capital_within_subject", "forbidden_outline_overlap_ratio_lte"]}}}}}}},
    {"if": {"properties": {"schema_version": {"const": "0.3.0"}}, "required": ["schema_version"]}, "then": {"properties": {"assertions": {"items": {"required": ["tolerance_policy"]}}}}}
  ],
  "additionalProperties": false
}
